{
  "version": 1,
  "archetypeId": "asset-management-analytics",
  "sourceReferences": [
    "/Users/hesong/Downloads/project-9684331"
  ],
  "patterns": [
    {
      "id": "dashboard-with-quick-entries",
      "routeRole": "dashboard",
      "layoutIntent": "dashboard-with-quick-entries",
      "decisionQuestion": "Which indicator, data source, or pending operation needs attention?",
      "primaryDataObject": "indicator-program",
      "kpiCards": ["total indicators", "quality warnings", "pending approvals", "active extracts"],
      "tableColumns": [],
      "detailSections": ["KPI strip", "trend chart", "pending items", "quick entries", "source overview"],
      "drawerActions": [],
      "workflowStates": ["loading", "empty", "hover"],
      "emptyStateCopy": "No indicator activity yet. Start from asset catalog or create an extraction job.",
      "businessDensity": ["asset health", "approval", "source coverage", "quick entry", "quality alert"],
      "linksOut": ["/assets", "/query", "/quality", "/audit-log"],
      "expectedForgeComponents": ["StatCard", "SurfaceCard", "ProgressBar", "Label", "StyledLink"],
      "forbiddenShortcuts": ["Do not edit formulas or permissions from the dashboard."]
    },
    {
      "id": "asset-list-with-detail",
      "routeRole": "list",
      "layoutIntent": "asset-list-with-detail",
      "decisionQuestion": "Which indicator is reusable, incomplete, stale, or ready for query?",
      "primaryDataObject": "indicator-asset",
      "kpiCards": ["active assets", "stale assets", "restricted assets", "quality warnings"],
      "tableColumns": ["indicator", "owner", "domain", "freshness", "lineage", "calculation", "permission", "quality", "next action"],
      "detailSections": ["asset identity", "lineage", "usage", "permission snapshot", "quality summary"],
      "drawerActions": ["open query", "review permission", "open quality"],
      "workflowStates": ["loading", "empty", "hover", "saving"],
      "emptyStateCopy": "No indicator asset matches this domain or owner filter.",
      "businessDensity": ["owner", "lineage", "freshness", "permission", "quality"],
      "linksOut": ["/query", "/permission", "/quality"],
      "expectedForgeComponents": ["DataTable", "ToolbarSearchInput", "ButtonGroup", "Label", "ProgressBar", "StyledLink"],
      "forbiddenShortcuts": ["Do not place formula editing and permission matrix inside the catalog row."]
    },
    {
      "id": "query-workbench",
      "routeRole": "detail",
      "layoutIntent": "query-workbench",
      "decisionQuestion": "Which filters, dimensions, and result fields answer the current business question?",
      "primaryDataObject": "query-result",
      "kpiCards": ["matched rows", "latency", "selected dimensions"],
      "tableColumns": ["dimension", "metric", "value", "delta", "segment", "updated at"],
      "detailSections": ["filter builder", "dimension selector", "result preview", "saved queries"],
      "drawerActions": ["run query", "save extract", "open analysis"],
      "workflowStates": ["loading", "empty", "saving", "saved", "error", "hover"],
      "emptyStateCopy": "Select an indicator and at least one dimension to preview results.",
      "businessDensity": ["filters", "dimensions", "preview", "latency", "saved query"],
      "linksOut": ["/extract", "/analysis"],
      "expectedForgeComponents": ["SurfaceCard", "DataTable", "Button", "ButtonGroup", "Label", "ProgressBar"],
      "forbiddenShortcuts": ["Do not edit asset permissions from the query workbench."]
    },
    {
      "id": "formula-workbench",
      "routeRole": "detail",
      "layoutIntent": "formula-workbench",
      "decisionQuestion": "Is this formula correct, explainable, and safe to apply to the indicator?",
      "primaryDataObject": "calculation-rule",
      "kpiCards": ["dependencies", "test pass rate", "affected assets"],
      "tableColumns": ["dependency", "source", "freshness", "owner", "risk"],
      "detailSections": ["formula editor", "dependency map", "test values", "explainability notes", "audit preview"],
      "drawerActions": ["validate formula", "open asset", "view audit"],
      "workflowStates": ["loading", "saving", "saved", "error", "hover"],
      "emptyStateCopy": "No formula is selected. Pick an indicator from the catalog first.",
      "businessDensity": ["formula", "dependency", "test value", "lineage", "audit"],
      "linksOut": ["/assets", "/quality", "/audit-log"],
      "expectedForgeComponents": ["SurfaceCard", "DataTable", "Label", "Button", "StyledLink", "ProgressBar"],
      "forbiddenShortcuts": ["Do not hide quality issue resolution inside the formula panel."]
    },
    {
      "id": "permission-matrix",
      "routeRole": "list",
      "layoutIntent": "permission-matrix",
      "decisionQuestion": "Who can view, edit, extract, or approve each indicator asset?",
      "primaryDataObject": "permission-rule",
      "kpiCards": ["role groups", "restricted assets", "pending approvals", "recent changes"],
      "tableColumns": ["role", "asset scope", "view", "edit", "extract", "approve", "risk", "last changed"],
      "detailSections": ["role scope", "risk preview", "approval chain", "audit history"],
      "drawerActions": ["update permission", "open asset", "view audit"],
      "workflowStates": ["loading", "empty", "saving", "saved", "error", "hover"],
      "emptyStateCopy": "No permission rule is configured for this domain.",
      "businessDensity": ["role", "scope", "asset", "approval", "risk", "audit"],
      "linksOut": ["/assets", "/audit-log"],
      "expectedForgeComponents": ["DataTable", "ButtonGroup", "Label", "SurfaceCard", "StyledLink"],
      "forbiddenShortcuts": ["Do not combine permission matrix with query result tables."]
    }
  ]
}
