{
  "version": 1,
  "archetypeId": "case-triage-operations",
  "sourceReferences": [
    "/Users/hesong/Downloads/protask-figma",
    "/Users/hesong/Documents/gihub_space/forge/tmp/spec-to-forge-output/prior-auth-ops-c12-protask"
  ],
  "patterns": [
    {
      "id": "hero-overview",
      "routeRole": "dashboard",
      "layoutIntent": "hero-overview",
      "decisionQuestion": "Which queue, SLA risk, or blocked decision needs attention first?",
      "primaryDataObject": "operations-program",
      "kpiCards": ["open cases", "SLA breaches", "blocked decisions", "team capacity"],
      "tableColumns": [],
      "detailSections": ["hot queues", "SLA burn-down", "policy drift", "team load", "quick links"],
      "drawerActions": [],
      "workflowStates": ["loading", "empty", "hover"],
      "emptyStateCopy": "No urgent operations work. Review policy drift or open the case queue.",
      "businessDensity": ["priority", "SLA", "load", "risk", "next action"],
      "linksOut": ["/cases", "/tasks", "/rules"],
      "expectedForgeComponents": ["StatCard", "SurfaceCard", "ProgressBar", "Label", "StyledLink"],
      "forbiddenShortcuts": ["Do not approve, reject, or edit policy from the dashboard."]
    },
    {
      "id": "list-with-filters-and-drawer",
      "routeRole": "list",
      "layoutIntent": "list-with-filters-and-drawer",
      "decisionQuestion": "Which case should be opened, assigned, escalated, or deferred?",
      "primaryDataObject": "case",
      "kpiCards": ["urgent", "unassigned", "due today", "escalated"],
      "tableColumns": ["case", "requester", "priority", "SLA", "risk score", "assignee", "reason", "age", "next step"],
      "detailSections": ["triage preview", "evidence snapshot", "similar cases"],
      "drawerActions": ["open case", "bulk assign", "escalate"],
      "workflowStates": ["loading", "empty", "hover", "saving"],
      "emptyStateCopy": "No case matches this filter. Clear severity or owner filters to broaden the queue.",
      "businessDensity": ["priority", "SLA", "risk", "owner", "reason", "next step"],
      "linksOut": ["/cases/[id]", "/tasks"],
      "expectedForgeComponents": ["DataTable", "ToolbarSearchInput", "ButtonGroup", "Label", "StyledLink", "SurfaceCard"],
      "forbiddenShortcuts": ["Do not show final approval controls in the list row."]
    },
    {
      "id": "split-pane-triage",
      "routeRole": "detail",
      "layoutIntent": "split-pane-triage",
      "decisionQuestion": "Should this case be approved, rejected, escalated, or returned after reviewing evidence?",
      "primaryDataObject": "case",
      "kpiCards": [],
      "tableColumns": ["evidence", "source", "status", "last checked"],
      "detailSections": ["identity strip", "risk factors", "evidence dossier", "similar cases", "SOP checklist", "decision note", "audit trail"],
      "drawerActions": ["approve", "reject", "escalate", "return"],
      "workflowStates": ["loading", "saving", "saved", "error", "hover"],
      "emptyStateCopy": "This case has no validated evidence yet. Return it to intake before deciding.",
      "businessDensity": ["evidence", "risk", "SOP", "similarity", "decision note", "audit"],
      "linksOut": ["/tasks", "/rules", "/audit-logs"],
      "expectedForgeComponents": ["SurfaceCard", "DataTable", "Label", "ProgressBar", "HistoryItem", "Button", "StyledLink"],
      "forbiddenShortcuts": ["Do not edit rule thresholds or intake schema from case detail."]
    },
    {
      "id": "kanban-board-with-row-actions",
      "routeRole": "board",
      "layoutIntent": "kanban-board-with-row-actions",
      "decisionQuestion": "Which work item should move to the next state and what is blocking it?",
      "primaryDataObject": "task",
      "kpiCards": ["ready", "in review", "blocked", "done today"],
      "tableColumns": [],
      "detailSections": ["lane summary", "task cards", "blocker reason", "owner capacity"],
      "drawerActions": ["move", "assign", "open case"],
      "workflowStates": ["loading", "empty", "hover", "saving"],
      "emptyStateCopy": "No task is in this lane. Check the case queue for new work.",
      "businessDensity": ["state", "owner", "blocker", "due time", "handoff"],
      "linksOut": ["/cases/[id]"],
      "expectedForgeComponents": ["SurfaceCard", "Label", "Button", "StyledLink", "ProgressBar"],
      "forbiddenShortcuts": ["Do not make final case decisions from the board card."]
    },
    {
      "id": "policy-matrix-with-impact",
      "routeRole": "list",
      "layoutIntent": "policy-matrix-with-impact",
      "decisionQuestion": "Which rule or threshold should change without harming queue quality?",
      "primaryDataObject": "policy-rule",
      "kpiCards": ["active rules", "pending changes", "high impact", "drift alerts"],
      "tableColumns": ["rule", "threshold", "coverage", "false positive rate", "affected queues", "owner", "state", "last changed"],
      "detailSections": ["impact preview", "approval requirement", "audit history"],
      "drawerActions": ["review impact", "adjust rule"],
      "workflowStates": ["loading", "empty", "hover", "saving"],
      "emptyStateCopy": "No policy rule matches this queue. Create or import a rule set before automation.",
      "businessDensity": ["threshold", "coverage", "impact", "approval", "audit"],
      "linksOut": ["/cases", "/audit-logs"],
      "expectedForgeComponents": ["DataTable", "ProgressBar", "Label", "SurfaceCard", "Button", "StyledLink"],
      "forbiddenShortcuts": ["Do not hide policy changes inside settings."]
    },
    {
      "id": "audit-stream",
      "routeRole": "audit",
      "layoutIntent": "audit-stream",
      "decisionQuestion": "Who changed a case, task, rule, or setting and why?",
      "primaryDataObject": "audit-event",
      "kpiCards": ["events today", "policy changes", "case decisions", "settings changes"],
      "tableColumns": ["time", "actor", "action", "object", "reason", "before after", "trace id"],
      "detailSections": ["event stream", "object filter", "actor filter", "reason preview"],
      "drawerActions": ["inspect event", "open related case"],
      "workflowStates": ["loading", "empty", "hover"],
      "emptyStateCopy": "No audit event matches this filter.",
      "businessDensity": ["actor", "action", "object", "reason", "timestamp"],
      "linksOut": [],
      "expectedForgeComponents": ["DataTable", "ToolbarSearchInput", "Label", "SurfaceCard"],
      "forbiddenShortcuts": ["Do not provide write actions in audit stream."]
    }
  ]
}
