{
  "version": 1,
  "archetypeId": "quality-governance-control-tower",
  "sourceReferences": [
    "/Users/hesong/Downloads/project-9684331",
    "/Users/hesong/Downloads/protask-figma",
    "/Users/hesong/Documents/gihub_space/forge/tmp/spec-to-forge-output/prior-auth-ops-c12-protask"
  ],
  "patterns": [
    {
      "id": "hero-overview",
      "routeRole": "dashboard",
      "layoutIntent": "hero-overview",
      "decisionQuestion": "Which source, run, or report needs attention before submission?",
      "primaryDataObject": "quality-program",
      "kpiCards": ["quality score", "auto-fixable rows", "blocking issues", "ready reports"],
      "tableColumns": [],
      "detailSections": ["risk focus", "report readiness rail", "lifecycle quick links"],
      "drawerActions": [],
      "workflowStates": ["loading", "empty", "hover"],
      "emptyStateCopy": "No blocked quality work. Create a scan from a healthy data source.",
      "businessDensity": ["risk stream", "next best action", "report readiness", "blocked run shortcut"],
      "linksOut": ["/quality-runs", "/issues", "/reports"],
      "expectedForgeComponents": ["StatCard", "SurfaceCard", "ProgressBar", "Label", "StyledLink"],
      "forbiddenShortcuts": ["Do not host import, scan setup, diff repair, report export, and audit in dashboard."]
    },
    {
      "id": "source-inventory",
      "routeRole": "list",
      "layoutIntent": "source-inventory",
      "decisionQuestion": "Which source is healthy enough to scan?",
      "primaryDataObject": "data-source",
      "kpiCards": ["connected sources", "warning sources", "offline sources"],
      "tableColumns": ["source name", "owner department", "source type", "health", "row count", "last sync", "schema readiness", "next action"],
      "detailSections": ["connection health", "schema mapping", "last run summary"],
      "drawerActions": ["create scan from source", "view source detail"],
      "workflowStates": ["loading", "empty", "hover", "saved"],
      "emptyStateCopy": "No data source is connected yet. Add a CSV, Excel, or database table before creating a scan.",
      "businessDensity": ["source health", "schema readiness", "owner", "last sync", "scan entry"],
      "linksOut": ["/quality-runs/new"],
      "expectedForgeComponents": ["DataTable", "CellTextSubtitle", "Label", "ProgressBar", "StyledLink", "SurfaceCard"],
      "forbiddenShortcuts": ["Do not edit quality templates in the source list."]
    },
    {
      "id": "policy-template-library",
      "routeRole": "list",
      "layoutIntent": "policy-template-library",
      "decisionQuestion": "Which standard template is reliable enough for this dataset?",
      "primaryDataObject": "quality-template",
      "kpiCards": ["active templates", "average coverage", "draft templates"],
      "tableColumns": ["template", "standard ref", "version", "rule count", "coverage", "status", "detail link"],
      "detailSections": ["rule categories", "coverage gaps", "fix strategy coverage"],
      "drawerActions": ["inspect rules", "create scan with template"],
      "workflowStates": ["loading", "empty", "hover"],
      "emptyStateCopy": "No standard template is active. Publish a template before scanning data.",
      "businessDensity": ["standard ref", "version", "coverage", "rule count", "fix strategy coverage"],
      "linksOut": ["/templates/[id]", "/quality-runs/new"],
      "expectedForgeComponents": ["DataTable", "ProgressBar", "Label", "StyledLink", "SurfaceCard"],
      "forbiddenShortcuts": ["Do not run scans directly from a template detail without source and scope review."]
    },
    {
      "id": "tabbed-policy-detail",
      "routeRole": "detail",
      "layoutIntent": "tabbed-policy-detail",
      "decisionQuestion": "Is this template coverage, rule logic, and fix strategy safe to use for a scan?",
      "primaryDataObject": "quality-template",
      "kpiCards": ["rule groups", "coverage", "fix strategy coverage", "open gaps"],
      "tableColumns": ["rule", "dimension", "severity", "coverage", "fix strategy", "last verified"],
      "detailSections": ["template identity", "rule groups", "coverage gaps", "version history", "audit evidence"],
      "drawerActions": ["create scan with template", "compare version"],
      "workflowStates": ["loading", "empty", "hover", "saving"],
      "emptyStateCopy": "No rule group is published for this template version.",
      "businessDensity": ["coverage", "rules", "fix strategy", "version", "audit"],
      "linksOut": ["/quality-runs/new", "/audit-logs"],
      "expectedForgeComponents": ["SurfaceCard", "DataTable", "ProgressBar", "Label", "StyledLink"],
      "forbiddenShortcuts": ["Do not edit source connection health inside template detail."]
    },
    {
      "id": "run-queue-with-health",
      "routeRole": "list",
      "layoutIntent": "run-queue-with-health",
      "decisionQuestion": "Which scan event is blocked, failed, or ready for diagnosis?",
      "primaryDataObject": "quality-run",
      "kpiCards": ["running", "blocked", "completed", "failed"],
      "tableColumns": ["batch", "source", "template", "status", "score", "issue count", "owner", "started at", "diagnose link"],
      "detailSections": ["run health", "issue distribution", "retry readiness"],
      "drawerActions": ["open run", "create run"],
      "workflowStates": ["loading", "empty", "hover", "saving"],
      "emptyStateCopy": "No scan has been created for this reporting window.",
      "businessDensity": ["status", "score", "issue count", "owner", "retry state"],
      "linksOut": ["/quality-runs/new", "/quality-runs/[id]"],
      "expectedForgeComponents": ["DataTable", "ProgressBar", "Label", "StyledLink", "SurfaceCard"],
      "forbiddenShortcuts": ["Do not confirm issue repair from the run queue."]
    },
    {
      "id": "split-pane-diff-repair",
      "routeRole": "detail",
      "layoutIntent": "split-pane-diff-repair",
      "decisionQuestion": "Should this fix strategy be applied after reviewing root cause, impact, and diff?",
      "primaryDataObject": "quality-issue",
      "kpiCards": [],
      "tableColumns": [],
      "detailSections": ["identity strip", "root cause", "impact scope", "before after diff", "strategy panel", "similar issues", "audit trail"],
      "drawerActions": ["confirm repair", "escalate", "ignore", "return to run"],
      "workflowStates": ["loading", "saving", "saved", "error", "empty", "hover"],
      "emptyStateCopy": "No diff is available because this issue requires manual review.",
      "businessDensity": ["root cause", "impact scope", "diff", "strategy", "rollback", "audit"],
      "linksOut": ["/quality-runs/[id]", "/audit-logs"],
      "expectedForgeComponents": ["SurfaceCard", "Label", "ProgressBar", "HistoryItem", "Button", "StyledLink"],
      "forbiddenShortcuts": ["Do not export reports or edit templates from issue repair."]
    },
    {
      "id": "report-preview-with-evidence",
      "routeRole": "report",
      "layoutIntent": "report-preview-with-evidence",
      "decisionQuestion": "Is this compliance report ready for submission with enough evidence?",
      "primaryDataObject": "quality-report",
      "kpiCards": ["score", "critical open", "hash status", "signature readiness"],
      "tableColumns": ["section", "status", "evidence count", "last updated"],
      "detailSections": ["cover", "summary", "rule results", "repair records", "compliance statement", "appendix"],
      "drawerActions": ["export", "view audit chain"],
      "workflowStates": ["loading", "empty", "hover", "saved"],
      "emptyStateCopy": "Report is not ready until all critical issues are closed or documented.",
      "businessDensity": ["hash", "evidence chain", "repair records", "submission readiness"],
      "linksOut": ["/audit-logs", "/issues"],
      "expectedForgeComponents": ["SurfaceCard", "DataTable", "ProgressBar", "Label", "StyledLink"],
      "forbiddenShortcuts": ["Do not repair issue rows inside report preview."]
    },
    {
      "id": "settings-grouped",
      "routeRole": "settings",
      "layoutIntent": "settings-grouped",
      "decisionQuestion": "Which threshold, role, notification, or execution setting controls quality governance?",
      "primaryDataObject": "quality-setting",
      "kpiCards": ["active standards", "roles", "notification rules", "auto-fix policies"],
      "tableColumns": ["setting", "scope", "value", "owner", "last changed"],
      "detailSections": ["quality thresholds", "role permissions", "notification rules", "execution policy", "audit policy"],
      "drawerActions": ["update setting", "view audit"],
      "workflowStates": ["loading", "empty", "saving", "saved", "error", "hover"],
      "emptyStateCopy": "No quality setting is configured for this tenant.",
      "businessDensity": ["threshold", "role", "notification", "execution policy", "audit"],
      "linksOut": ["/templates", "/audit-logs"],
      "expectedForgeComponents": ["SurfaceCard", "DataTable", "Label", "Button", "StyledLink"],
      "forbiddenShortcuts": ["Do not diagnose runs or repair issues from settings."]
    }
  ]
}
